---
layout: page
title: 🏺 Rétrospective
order: 20
---

## 2021

* Vendredi 02/04 17h00-18h45 Sport
* Mercredi 31/03 19h30-20h30 Réunion des bénévoles
* Mercredi 31/03 17h00-18h45 [Informatique : Initiation à la ligne de commande]({% post_url  2021-03-31-atelier-informatique  %})
* Samedi 27/03 14h-16h [Expérience scientifique]({% post_url 2021-03-27-atelier-experiences-scientifiques %}) (Collégiens : 14h-15h, Primaires : 15h-16h)
* Vendredi 26/03 16h30-18h45 Sport : Ping Pong
* Mercredi 24/03 17h00-18h45 Maths : [Dessin de rosaces]({% post_url  2021-03-24-atelier-maths %})
* ~~Samedi 20/03 11h-12h30 Lecture et écriture~~
* Vendredi 19/03 16h30-17h45 [Sport]({% post_url  2021-03-19-football %})
* Mercredi 17/03 16h30-17h45 [Cuisine : Wraps au thon]({% post_url 2021-03-17-wraps-au-thon %})
* ~~Samedi 13/03 14h-15h30 Défi AECS~~
* Vendredi 12/03 16h30-17h45 [Sport]({% post_url 2021-03-12-sport %})
* Mercredi 10/03 (16h30-17h45) [Musique]({% post_url 2021-03-10-atelier-musique %})
* Vendredi 5/03 (16h30-17h45): Atelier Langue Arabe
* Mercredi 3/03 (16h30-17h45) [Cuisine du monde : Bagels au saumon]({% post_url  2021-03-03-atelier-cuisine %})
* ~~Samedi 27/02 (14h-16h) : Défi AECS~~
* Vendredi 26/02  (16h30-17h45) : Atelier Langue Arabe
* ~~Jeudi 24/02 (14h-16h) : Atelier Karaoké~~
* Mercredi 23/02 (16h-17h45) : [Atelier Cuisine du monde : Tapas]({% post_url 2021-02-23-cuisine-du-monde %})
* ~~Samedi 20/02 (14h-15h30) : Club lecture~~
* Vendredi 19/02 (16h00-17h45) : [Atelier Langue Arabe]({% post_url 2021-02-19-atelier-langue-arabe %})
* Jeudi 18/02 (14h-16h) : Atelier Karaoké
* Mercredi 17/02 (16h-17h45) : [Atelier cuisine Nouvel An Chinois]({% post_url  2021-02-10-atelier-cuisine-du-monde %})
* Lundi 15/02 (14h-16h) : [Atelier décoration Nouvel An Chinois]({% post_url 2021-02-15-decoration-nouvel-an-chinois %})
* ~~Vendredi 12/02 (16h30-17h45) : Atelier Langue l'Arabe~~
* Mercredi 10/02 (16h30-17h45) : [Atelier Cuisine]({% post_url 2021-02-10-atelier-cuisine-du-monde %}).
* Samedi 06/02 (14h-17h) Informatique ([BD, développement]({% post_url 2021-02-06-atelier-informatique %})).
* Vendredi 05/02 (16h30-17h45) : [Atelier patisserie (petits sablés)]({% post_url 2021-02-05-atelier-petits-sables %}).
* Mercredi 03/02 (18h30-19h30): Réunion des bénévoles.
* Samedi 30/01/2021 (14h-15h30) : [Club lecture]({% post_url 2021-01-30-club-lecture %})..
* Vendredi 29/01/2021 (16h30-17h45) : [Atelier Cuisine (crêpes spirales)]({% post_url 2021-01-29-atelier-crepes %}).
* Samedi 23/01/2021 (14h-15h30): [Atelier pâte à sel]({% post_url 2021-01-23-atelier-pate-a-sel %}).
* Samedi 16/01/2021 (14h-15h30): Projection d'un film (le chat du rabbin)
* Samedi 09/01/2021 (14h-15h30): [Galette des rois]({% post_url 2021-01-09-galette-des-rois-et-reines %})
* Samedi 02/01/2021 (14h-16h):  Projection d'un film

## 2020

<p><iframe allow="accelerometer; autoplay; encrypted-media; gyroscope; picture-in-picture" allowfullscreen="" frameborder="0" style="width: 100%; max-width: 560px; height: 300px;" src="https://www.youtube.com/embed/U0qCkynevWI"></iframe></p>

* Mardi 22/12/2020 (14h-15h): Défi AECS
* Lundi 21/12/2020 (13h-14h): [Atelier Cuisine]({% post_url 2020-12-21-cuisine-de-noel %})
* Samedi 19/12/2020 (14h-15h30): [Atelier Musique]({% post_url 2020-12-19-second-atelier-musique %})
* Samedi 12/12/2020 (14h-15h): ~~Défi AECS~~ [Décorations de noël]({% post_url 2020-12-12-decorations-noel %})
* Vendredi 11/12/2020 (17h30-18h30): Club Lecture
* Samedi 5/12/2020 (14h-15h30): [Création de BD avec le logiciel BDnF]({% post_url 2020-12-05-creation-de-bandes-dessinees %})
* Mercredi 02/12/2020 (18h-19h) Club Lecture
* Samedi 28/11/2020 (14h-15h): Défi AECS
* Vendredi 27/11/2020 (17h30-18h30): [Club Lecture]({% post_url 2020-11-27-premiere-rencontre-club-lecture %})
* Samedi 21/11/2020 (14h-15h30): [Atelier musique]({% post_url 2020-11-21-atelier-musique %})
* ~~Samedi 31/10/2020 (18h - 20h): Soirée Halloween~~
* ~~Samedi 31/10 (16h30-18h): Activité cuisine~~
* ~~Vendredi 30/10 : Atelier Musique (17h30 - 19h)~~
* Mardi 27/10 (17h30 - 19h): [Activité origami]({% post_url 2020-10-27-atelier-origami %})
* Samedi 24/10 (14h - 15h30): [Atelier décoration Halloween]({% post_url 2020-10-24-atelier-halloween %})
* Lundi 19/10/2020 (17h30 - 19h): [Activité jeux de société]({% post_url 2020-10-19-atelier-jeux-de-societes %})
* Vendredi 16/10/2020 (17h30 - 19h): [Peinture]({% post_url 2020-10-16-a-vos-pinceaux %})
* Vendredi 09/10/2020 (17h30 - 19h): [Jeu d'agilité]({% post_url 2020-10-09-premier-atelier %})
* Mercredi 21/09/2020 : [Réunion bénévoles]({% post_url 2020-09-22-rencontre-benevoles %})

## 2019

<p><iframe allow="accelerometer; autoplay; encrypted-media; gyroscope; picture-in-picture" allowfullscreen="" frameborder="0" src="https://www.youtube.com/embed/KpuS7svqHcg" style="width: 100%; max-width: 560px; height: 300px;"></iframe></p>

* Atelier Art Plastique Mercredi de 17h30 à 19h, en partenariat avec l'Atelier des Epinettes
* Atelier Theatre en Anglais, Vendredi de 18h 19h
* Atelier Programmation, Samedi de 14h à 16h

## 2018

<p><iframe allow="accelerometer; autoplay; encrypted-media; gyroscope; picture-in-picture" allowfullscreen="" frameborder="0" src="https://www.youtube.com/embed/2wjfwUYdw9w" style="width: 100%; max-width: 560px; height: 300px;"></iframe></p>

## 2010

* 26 juin, Les enfants de l'AECS s'accrochent à Accrobranche.
* Enfin ! C'est la fin de l'année scolaire !!! Goûter du 30 juin 2011
* Les enfants de l'AECS envahissent le Village Gaulois, le 7 juillet 2011
* au Parc Floral le 22 mai 2011
* Le 3 avril à la Piscine de Montreuil
* Mercredi 8 décembre : Sortie au Cirque
* Mardi 26 octobre : [Soirée AECS]({% post_url 2010-10-26-soiree-aecs %})
* 14 octobre : [Soirée hommage à Douarlé]({% post_url 2010-10-20-hommage-douarle %})
* Sortie en bateau mouche le26 septembre 2010
* Sortie au Musée de la Poupée, le 19 septembre 2010
* Le 27 Juin 2010 Viste du Musée de la Marine
* 19 Juin 2010 Piquenique et stand à la Fête de Quartier
* Le 12 Juin 2010 : Palais Découverte "Les Dinosaures"
* Pique Nique Parents / enfants / bénévoles
* 25 Avril 2010 : Sortie Théatre pour voir "Peau d'Ours"
* 9 janvier 2010 : Sortie au Cirque Pinder
